{
  "policy_metadata": {
    "policy_id": "test-policy_ad570ad8",
    "version": "1.0.0",
    "created_at": "2025-06-10T19:52:19.532642+00:00",
    "profile_type": "custom",
    "description": "Custom custom profile: test-policy",
    "__comment": "Generated custom profile template"
  },
  "execution_profile": {
    "name": "custom",
    "priority": 5,
    "timeout_seconds": 120,
    "max_concurrent_tasks": 20,
    "memory_limit_mb": 256,
    "enable_debug": false,
    "__comment": "Execution settings for this profile"
  },
  "routing": {
    "primary_model": {
      "model_id": "gpt-4o",
      "provider": "openai",
      "timeout_seconds": 60,
      "confidence_threshold": 0.8,
      "max_tokens": 4096,
      "temperature": 0.3
    },
    "fallback_chain": [
      {
        "model_id": "claude-3-sonnet",
        "provider": "anthropic",
        "timeout_seconds": 45,
        "confidence_threshold": 0.75,
        "max_tokens": 4096,
        "temperature": 0.3,
        "fallback_conditions": [
          "timeout",
          "low_confidence",
          "error"
        ],
        "priority": 1
      }
    ],
    "selection_strategy": "confidence",
    "load_balancing": {
      "enabled": false,
      "algorithm": "round_robin",
      "weights": {}
    },
    "__comment": "Primary routing configuration with fallback chain"
  },
  "fallbacks": {
    "escalation_thresholds": {
      "confidence_threshold": 0.7,
      "timeout_threshold": 120,
      "error_rate_threshold": 0.2,
      "latency_threshold_ms": 5000
    },
    "retry_policy": {
      "max_retries": 3,
      "base_delay_ms": 1000,
      "backoff_multiplier": 2.0,
      "jitter_enabled": true
    },
    "circuit_breaker": {
      "failure_threshold": 5,
      "recovery_timeout_ms": 30000,
      "half_open_max_calls": 3
    },
    "__comment": "Fallback escalation and recovery policies"
  },
  "uid_lineage": {
    "threading_strategy": "hierarchical",
    "lineage_depth": 5,
    "uid_format": {
      "pattern": "{timestamp}_{entropy}_{agent_id}_{sequence}_{parent_ref}",
      "components": [
        "timestamp",
        "entropy",
        "agent_id",
        "sequence",
        "parent_ref"
      ],
      "separator": "_"
    },
    "persistence": {
      "enabled": true,
      "storage_backend": "redis",
      "retention_hours": 168
    },
    "__comment": "UID lineage tracking and persistence configuration"
  },
  "logging": {
    "level": "INFO",
    "format": "structured",
    "outputs": [
      {
        "type": "console",
        "enabled": true
      },
      {
        "type": "file",
        "enabled": true,
        "path": "/logs/custom/smartrepo_custom.log",
        "rotation": {
          "enabled": true,
          "max_size_mb": 50,
          "backup_count": 10
        }
      }
    ],
    "fields": {
      "include_timestamp": true,
      "include_thread_id": true,
      "include_process_id": false,
      "include_uid_lineage": true,
      "mas_lite_compliance": true
    },
    "__comment": "Logging configuration with MAS Lite Protocol v2.1 compliance"
  },
  "output": {
    "format": {
      "type": "json",
      "encoding": "utf-8",
      "pretty_print": true,
      "compression": {
        "enabled": false,
        "algorithm": "gzip"
      }
    },
    "delivery": {
      "method": "asynchronous",
      "reliability": "at_least_once",
      "batch_size": 10,
      "flush_interval_ms": 1000
    },
    "validation": {
      "enabled": true,
      "schema_validation": true,
      "checksum_enabled": true,
      "mas_lite_compliance": true
    },
    "__comment": "Output formatting and delivery configuration"
  }
}